안드로이드 엔지니어,App,"Android, Kotlin, RxJava, aac, MVVM, Android Studio, "
백엔드 엔지니어,Back-end,"백엔드개발자, 서버API, "
iOS 모바일 앱 개발자,App,"iOS, Swift, 모바일앱개발, Objective-C, iPhone, RxSwift, "
프론트엔드 개발자,Front-end,"Front-end, React, vue, Redux, ReactNative, Android앱개발, ios 앱개발, JavaScript, "
모바일 앱 클라이언트(unity) 개발,Game,"unity, Unity 3D, 클라이언트 개발, 모바일게임개발, "
리액트 개발자(주니어),Front-end,"JavaScript, CSS, Node.js, MySQL, Front-end, React, GitHub, Amazon AWS, "
<소개팅앱 골드스푼> 모바일 앱 개발자 채용(React Native),App,"ReactNative, Meteor, MongoDB, CoffeeScript, Amazon AWS, "
"웹개발자/데이터베이스전문자(DBA) - 각 분야 신입,경력 모집",Database,"JSP, Oracle DB, Java, "
프론트엔드 (웹)개발자 채용공고,Front-end,"웹 프론트엔드 개발(HTML5/CSS3/JavaScript/Vue.js), 웹서비스, 프론트엔드 개발, 프론트엔드개발자, 프론트엔드, 웹프론트엔드 개발, 웹개발, "
Web Front-end Developer,Front-end,"WebRTC/Websocket, JavaScript, TypeScript, canvas, webaudio, Node.js, HTML5, CSS, React, Redux, react-native, Android, iOS, "
Deep Learning Engineer - AI 엔진 구축,AI,"Python, PyTorch, Machine Learning, Deep Learning (딥러닝), Git, ML/DeepLearning, "
[연봉 인상 최대 30%] Backend 백엔드 개발자 (경력),Back-end,"Back-end, Amazon AWS, PostgreSQL, Git, Java, Kotlin, 백엔드, 백엔드 개발, spring-framework, Spring, 코틀린, "
[연봉 인상 최대 30%] App 모바일 앱 개발자 (경력),App,"Git, Android, 안드로이드 앱개발, iOS, ios 앱개발, 어플리케이션 개발, Flutter, native app 개발, 아이폰개발자, 모바일앱개발, Android앱개발, "
Front-end(프론트엔드) 엔지니어 채용,Front-end,"Javascript(ES6+), Vue.js, HTML5, CSS3, jQuery, Front-end, webpack, quasar-framework, Cordova, electron, Bulma, Bootstrap, Git, vuex, "
"청와대와 은행이 사용하는 보안솔루션 개발자(Go, React, Node.js) 채용",Security,"Go, DID, 블록체인, Linux, Docker, Android, iOS, Node.js, JSP, Git, "
웹 프론트엔드 개발자(REACT),Front-end,"JavaScript, CSS, React, Front-end, HTML, GitHub, vercel, Amazon AWS, "
UI개발 싫어하는 시스템 프로그래밍 개발자(Go) / UI 개발 좋아하는 React 개발자 채용,Front-end,"Go, React, Node.js, Java, Android, iOS, JSP, "
서버 개발자 경력직 신규채용 (java / spring),Back-end,"Java, MySQL, Redis, Spring, Amazon AWS, Linux, MariaDB, Solr, Back-end, "
백엔드 개발자 채용,Back-end,"Python, Node.js, Back-end, Git, GitHub, MySQL, 서버관리, Microsoft Azure, Naver Cloud, naver cloud platform, 금융클라우드, "
Software Engineer - Backend,Back-end,"Back-end, Python, 서버관리, Django, 풀스택개발, 소프트웨어아키텍처, Amazon AWS, nltk, Pandas, graphql, scikit-learn, "
[블록체인/핀테크] 웹프론트/풀스텍 개발자 2분을 모십니다.,Full-stack,"Front-end, React, Node.js, Amazon AWS, HTML5, CSS, TypeScript, Redis, Docker, Fullstack Development, Back-end, 풀스택개발, Java, 블록체인, blockchain, 비트코인, bitcoin, 이더리움, ethereum, 스마트컨트랙트, Smartcontract, blockchain wallet, 트레이딩, 알고리즘트레이딩, 시스템트레이딩, 핀테크, 가상화폐, 암호화폐, JavaScript, "
"[빌베 개발팀은 친구가 필요행] 백엔드 / 서버 개발자 칭구칭긔 (feat. Laravel, MySQL, 웹 개발)",Back-end,"Android, iOS, Flutter, Laravel, html/css, MySQL, php/laravel, Vue.js, VueJs, vuex, "
영상서버개발자,Back-end,"Java, Python, HTML5, CSS3, Vue.js, REST API, "
서버 개발자,Back-end,"Java, "
Android 개발자,App,"Android, Java, Kotlin, Rxjava2, RxAndroid, KOIN, data-binding, retrofit2, OkHttp3, JSON, XML, "
React / React-Native 개발자 팀원을 구해요!,Front-end,"react-native, React.js, JavaScript, React, Front-end, Amazon AWS, GitHub, "
Node.js Back-end 개발자 팀원을 구해요,Front-end,"Amazon AWS, Back-end, 서버관리, GitHub, Git, JavaScript, MySQL, Node.js, Front-end, React, 풀스택개발, "
프론트엔트(Front-end) 개발자 채용,Front-end,"JavaScript, React, Front-end, 풀스택개발, CSS, Back-end, Amazon AWS, 프론트엔드, 백엔드, 자바스크립트, 앱개발자, 웹개발자, 프론트엔드개발자, "
백엔트(Back-end) 개발자 채용,Back-end,"JavaScript, Front-end, 풀스택개발, CSS, Back-end, Amazon AWS, 백엔드, 자바스크립트, 앱개발자, 웹개발자, 프론트엔드개발자, 백엔드개발자, MongoDB, 서버개발자, Node.js, "
서비스 기획자 (산업기능요원/전문연구요원 복무 가능),,"Product planning, Agile Product Management, 서비스 기획, "
프론트엔드 엔지니어 (산업기능요원/전문연구요원 복무 가능),Front-end,"React.js, Redux, TypeScript, rxjs, CSS, HTML5, JavaScript, "
백엔드 엔지니어 (산업기능요원/전문연구요원 복무 가능),Back-end,"Python, Ruby On Rails, gdal, Redis, nginx, PostgreSQL, geoserver, postgis, PDAL, Celery, "
DevOps Engineer (산업기능요원/전문연구요원 복무 가능),,"aws, Python, CircleCI, Sentry, gdal, Redis, Amazon CloudWatch, nginx, PostgreSQL, "
Research Engineer - Computer Vision (산업기능요원/전문연구요원 복무 가능),,"computer-vision, deep-learning, image-processing, 컴퓨터비전, "
웹 GIS 엔지니어 (산업기능요원/전문연구요원 복무 가능),,"gis, openlayers, webgl, cesium, gdal, PostgreSQL, postgis, "
WEB APP 프론트엔드개발 프로그래머 모집,App,"Android, Java, jQuery, PHP, JavaScript, Python, iOS, Front-end, React, MySQL, Node.js, "
ionic 개발자 채용 (채용시 마감),Front-end,"JavaScript, HTML, CSS, Front-end, AngularJS, Node.js, Ionic, Amazon AWS, Back-end, 풀스택개발, GitHub, "
백엔드 개발자 채용 (채용시 마감),Back-end,"Front-end, Node.js, Amazon AWS, Back-end, 풀스택개발, GitHub, TypeScript, 서버관리, MySQL, "
"3D VR/AR개발 경력자 모집(Unity,Unreal)",,"Unity 3D, unity, unreal-engine4, Unreal, autodesk v red, 3D, AR/VR, 가상현실, 유니티, 증강현실, 360VR, 클라이언트 프로그래머, "
"금융 시스템에 관심있는 리액트 개발자 구인(포트폴리오 있는 신입가능, 1일 6시간 근무)",Front-end,"React, Front-end, Git, HTML5, CSS3, GitHub, "
열정과 능력이 넘치는 Data Scientist,Datascience,"서비스 기획, 데이터분석, 데이터사이언스, 빅데이터, 데이터마이닝, 빅데이터 마이닝, "
인플루언서 마케팅 플랫폼 백엔드 개발자,Back-end,"Python, Django, Back-end, Amazon AWS, MySQL, Git, 서버관리, "
AI/머신러닝 연구원 경력사원 채용 (업계최상위대우보장),AI,"Python, deep-learning, TensorFlow, PyTorch, "
IoT 센서 제품 개발 연구직 - 경력(업계최상위대우보상),Embedded,"C, C++, 임베디드 SW 개발, IoT Device, "
[연구개발팀] 프론트엔드 개발자,Front-end,"React.js, Responsive web, Front-end, GitHub, Amazon AWS, HTML5, CSS3, VueJs, JavaScript, "
Python 경력 개발자 모집 (경력 5~10년),Back-end,"Java, PHP, MySQL, Python, MongoDB, Amazon AWS, Back-end, 서버개발자, 풀스택개발, Ad-exchange, Laravel, golang, AWS Lambda, Redis, Git, 분석서버, "
iOS 어플리케이션 개발자,,"iOS, Swift, 모바일앱개발, 아이폰, iPhone, 아이폰개발자, ios 앱개발, "
웹 개발자,Full-stack,"JavaScript, Node.js, Amazon AWS, Back-end, Front-end, jQuery, "
리액트네이티브(React Native) 모바일 앱 개발자 정규직 모집,App,"react-native, React, Android, iOS, "
안드로이드 디벨로퍼 Android developer,App,"Android, iOS, Swift, Swift 개발 경험자, 모바일앱개발, native app 개발, Android앱개발, 안드로이드개발자, 안드로이드, 안드로이드개발, 어플리케이션 개발, 안드로이드 앱개발, 안드로이드 개발, "
Product Engineer,,"React, Redux, Next.js, Styled-components, Three.js, PixiJS, flex design system components, TypeScript, babel, webpack, Jest, storybook, "
Software Engineer (front-end developer),Front-end,"Front-end, SW 개발, "
[신입/경력] DBA 채용 공고,Database,"MySQL, dba, MariaDB, aws, Azure, toast, Elasticsearch, "
[경력] 백엔드 개발자 채용 공고,Back-end,"Python, 백엔드, 빅데이터, CTI, API, "
퍼블리셔 경력직 채용,,"Git, Vue.js, zeplin, JavaScript, HTML5, CSS, 웹퍼블리싱, CSS3, HTML, 퍼블리싱, 웹퍼블리셔, "
프론트엔드 경력직 채용,Front-end,"PHP, jQuery, Node.js, Front-end, JavaScript, HTML5, CSS3, "
아이폰 (iOS) 앱 개발자 채용합니다.,App,"iOS, Swift, RxSwift, ios 앱개발, iPhone, Objective-C, 아이폰개발자, "
안드로이드 앱 개발자 채용합니다.,App,"Android, Kotlin, RxJava, MVVM, 안드로이드개발자, RxAndroid, 안드로이드 앱개발, "
모바일 웹 프론트엔드 및 백엔드 개발자 모집 - 대한민국 최고의 블록체인 서비스 톡큰,Front-end,"React, Node.js, JavaScript, TypeScript, Java, spring-framework, SpringBoot, MongoDB, MariaDB, Redis, nginx, Git, Docker, Jenkins, vault, Firebase, ELK, "
스마트 컨트랙트(Smart Contract) 개발자 모집 - 대한민국 최고의 블록체인 서비스 톡큰,Front-end,"React, Node.js, JavaScript, TypeScript, Java, spring-framework, SpringBoot, MongoDB, MariaDB, Redis, nginx, Git, Docker, Jenkins, vault, Firebase, ELK, "
단 한 명의 딥러닝 Back-end Engineer를 위한 채용 공고,Back-end,"소프트웨어개발, 백엔드, Back-end, Python, JavaScript, Django REST framework, Java, Machine Learning, deep-learning, machine-vision, TensorFlow, TensorRT, RESTful-api, Amazon AWS, CUDA, rdbms, MySQL, PostgreSQL, TDD, gpgpu, CI/CD, "
단 한 명의 딥러닝 Research Engineer(석사 이상)를 위한 채용 공고,,"소프트웨어아키텍처, GitHub, PyTorch, TensorFlow, 컴퓨터공학, 컴퓨터비전, Machine Learning (머신러닝), Deep Learning (딥러닝), computer-vision, Linux, C, C++, C#, "
Back-end 개발자(인턴 및 경력),Back-end,"소프트웨어아키텍처, Back-end, Node.js, MySQL, TypeScript, "
Front-end 개발자(인턴 및 경력),Front-end,"React, JavaScript, CSS, HTML, Bootstrap, Amazon AWS, Front-end, "
머신러닝 엔지니어,AI,"Python, PyTorch, NumPy, Pandas, SageMaker, 머신러닝, "
웹개발자,Front-end,"JavaScript, React, CSS, 풀스택개발, Back-end, Front-end, "
인프라 모니터링 및 유지관리 담당자,,"솔루션 유지보수, 모니터링, 기술지원, "
탄탄한 스타트업에서 웹퍼블리셔 구인,,"퍼블리셔, 웹퍼블리싱, 웹 퍼블리셔, 웹 퍼블리싱, "
탄탄한 스타트업에서 JAVA 개발자 구인,,"Java, Spring Boot 2, querydsl, JPA:hibernate, MySQL, aws, Docker, Jenkins, mybatis, Spring, JPA, "
탄탄한 스타트업에서 QA 담당자 구인,,"QA 테스터, "
탄탄한 스타트업에서 CTO 구인,,"Java, Spring Boot 2, querydsl, JPA:hibernate, MySQL, aws, Docker, Jenkins, mybatis, Spring, JPA, Amazon AWS, Python, GitHub, 풀스택개발, jQuery, Front-end, Back-end, "
Java Spring API 개발자,Back-end,"Java, spring-boot, ORM, Amazon AWS, Back-end, Git, MySQL, JPA, NoSQL, CI/CD, 개발, 백엔드개발자, 백엔드 개발, 백엔드, aws, GCP, Azure, "
"[산업기능요원] 웹 프론트엔드 엔지니어(신입, 전직)",Front-end,"JavaScript, Front-end, Git, html/css, React, TypeScript, "
"[산업기능요원] 백엔드 엔지니어(신입, 전직)",Back-end,"Back-end, Git, TypeScript, Node.js, NestJs, JavaScript, Amazon AWS, Kubernetes, Docker, MongoDB, PostgreSQL, "
풀스택 개발자 (산업기능요원 전직/보충역),Full-stack,"Redis, Bootstrap, nginx, Front-end, CSS3, HTML5, GitHub, Node.js, React, jQuery, JavaScript, MongoDB, Back-end, 풀스택개발, aws, "
AI R&D 엔지니어 (산업기능요원 전직/보충역),,"React, JavaScript, Node.js, 풀스택개발, aws, GitHub, MongoDB, Bootstrap, Redis, nginx, Front-end, Back-end, CSS3, HTML5, jQuery, "
풀스택 개발자 (석사 이상),Full-stack,"React, JavaScript, Node.js, 풀스택개발, aws, GitHub, MongoDB, Bootstrap, Redis, nginx, Front-end, Back-end, CSS3, HTML5, jQuery, "
인프라 엔지니어 (석사 이상),,"golang, Amazon AWS, Git, JavaScript, Node.js, Docker, containers, MongoDB, storage, Redis, nginx, openvpn, GitHub, Back-end, 서버관리, devops, 소프트웨어아키텍처, "
풀스택 개발자,Full-stack,"JavaScript, React, Front-end, Back-end, Node.js, 풀스택개발, MongoDB, Azure, Database, 서버관리, Git, API, REST API, "
인프라 엔지니어,,"storage, Git, Redis, openvpn, Docker, GitHub, containers, MongoDB, JavaScript, nginx, devops, 소프트웨어아키텍처, Back-end, Node.js, golang, 서버관리, Amazon AWS, "
AI R&D 엔지니어 (석사 이상),AI,"React, JavaScript, Node.js, 풀스택개발, aws, GitHub, MongoDB, Bootstrap, Redis, nginx, Front-end, Back-end, CSS3, HTML5, jQuery, ai, "
Software Engineer (New Graduates/Experienced),,"소프트웨어개발, AI(인공지능), 음성인식인공지능(AI), 음성인식, 기계학습, 자연어처리, 머신러닝, Python(파이썬), JavaScript, Android, iOS, software-engineering, 텐서플로우, artificial-intelligence, speech-recognition, NLP, MapReduce, Python, 인공지능, STT, TensorFlow, distributed-computing, "
프론트엔드 엔지니어(리더급),Front-end,"Front-end, view, TypeScript, react-router, storybook, emotion, Sass, Redux, Redux-saga, redux-thunk, Immer, "
주니어 백엔드 엔지니어,Back-end,"Back-end, Node.js, "
데이터 엔지니어,Data-science,"Python, Amazon AWS, Kafka, Docker, "
DevOps 엔지니어,,"devops, Amazon AWS, CI/CD, 클라우드 인프라, "
QA 엔지니어 담당자,,"qa, QA 테스터, e2e-testing, web-api-testing, "
"주니어 백엔드 엔지니어(산업기능요원 보충역, 전직)",Back-end,"Back-end, Node.js, "
프론트엔드 엔지니어,Front-end,"React.js, GitHub, JavaScript, "
Software Engineer - Frontend,Front-end,"React, Node.js, JavaScript, Front-end, CSS3, CSS, D3.js, ssr, Styled-components, graphql, Amazon AWS, "
Software Engineer - Data,Datascience,"Data Science, 데이터사이언스, 빅데이터, data-warehousing, real-time streaming processing, 데이터, 통계학, R데이터분석, 데이터마이닝, 빅데이터 마이닝, R 통계, 빅데이터 엔지니어, 빅데이터 분석/인프라/가시화, data analyst, 데이터 엔지니어, Data Modeling, Data Engineering, R, 기계학습, data-analysis, "
Lead Software Engineer,Back-end,"Back-end, Python, 서버관리, Django, 풀스택개발, 소프트웨어아키텍처, Amazon AWS, nltk, Pandas, graphql, scikit-learn, "
CRM?DW? ISP 컨설팅 / 분석설계 / 개발 정규직 채용,,"data-warehouse, Data Architecture, CRM, JavaScript, Unix Linux system program, RDB/SQL, ISP, 데이터 모델링, "
데이터분석가 채용(경력우대),Datascience,"데이터분석, 통계학, 데이터사이언스, 빅데이터, data-analysis, data analyst, 데이터트래킹, 그로스해킹, 통계분석, 딥러닝, Data Modeling, "
AI 엔지니어 채용(경력우대),AI,"풀스택개발, AI(인공지능), 딥러닝, artificial-intelligence, 인공지능, feature engineering, Model Serving, R&D, "
프론트엔드 엔지니어 채용 (경력우대),Front-end,"React, ReactNative, 웹 프론트엔드 개발(HTML5/CSS3/JavaScript/Vue.js), RESTful-api, Git, ios 앱개발, 안드로이드 앱개발, "
웹 개발자 (Laravel & Vue) 를 찾습니다.,,"Laravel, PHP, MySQL, Vue.js, Git, "
빅데이터 시각화 웹 프론트엔드 개발자 인턴/신입 채용,Front-end,"JavaScript, Amazon AWS, Front-end, React, Amazon Amplify, Amazon Cognito, 빅데이터분석, 데이터시각화, "
빅데이터 시각화 웹 프론트엔드 개발자 경력 채용,Front-end,"JavaScript, Amazon AWS, Front-end, React, Amazon Amplify, Amazon Cognito, 빅데이터분석, 데이터시각화, "
AI 엔지니어,AI,"NLP, machine-learning, artificial-intelligence, 머신러닝, 인공지능, 딥러닝, chatbot, text-mining, Data Science, "
백엔드 개발자 모집 공고,Back-end,"Python, 파이썬, Back-end, Python(파이썬), "
iOS 개발자,,"iOS, Swift, RxSwift, ios 앱개발, 아이폰개발자, 아이폰, Swift 개발 경험자, "
쏘카(SOCAR) 자회사 차케어에서 프론트엔드 경력 개발자 채용,Front-end,"aws, Amazon AWS, GitHub, Front-end, JavaScript, React, "
백엔드 개발자 (Backend Software Engineer/풀타임/산업기능요원 보충역/전문연구요원),Back-end,"Python, Back-end, PostgreSQL, Docker, MongoDB, GitLab, RabbitMQ, "
프론트엔드 개발자(Frontend SW Engineer/산업기능요원 보충역/전문연구요원 지원가능),Front-end,"React, Redux, webpack, WebSocket, es6, GitLab, esnext, TypeScript, Styled-components, emotion, storybook, webrtc, "
Flutter 모바일 개발자(Mobile Developer/산업기능요원 보충역/전문연구요원 지원가능),App,"Flutter, Dart, Kotlin, Swift, iOS, Android, "
프로그래밍 교육 트레이너(강사),,"Python, Django, Flask, Back-end, Front-end, Git, React, JavaScript, CSS, HTML, os, Database, Redux, RDB/SQL, NoSQL, Pandas, matplotlib, seaborn, TensorFlow, Deep Learning (딥러닝), Machine Learning (머신러닝), "
Back End 개발자를 찾습니다.,Back-end,"Java, PHP, Node.js, MySQL, JavaScript, Back-end, JSP, Amazon AWS, 서버관리, Git, mssql, .NET, NoSQL, ORM, "
Python 개발자 채용,,"Java, PHP, Node.js, MySQL, JavaScript, Back-end, JSP, Amazon AWS, 서버관리, Git, mssql, .NET, NoSQL, ORM, "
데이터 엔지니어 경력직 채용,Datascience,"Python, SQL, R, 데이터사이언스, 빅데이터, 데이터마이닝, "
프론트엔드 개발자_경력,Front-end,"JavaScript, Front-end, "
서버/풀스택 개발자 경력직 채용,Full-stack,"MySQL, Node.js, RESTful-api, Redis, Vue.js, JavaScript, TypeScript, Back-end, 서버관리, "
"백엔드/프론트엔드 엔지니어 (Back-end, Front-end)",,"Back-end, Amazon AWS, Java, MySQL, 서버관리, NoSQL, 백엔드, 백엔드 개발, 프론트엔드 개발, 프론트엔드, Front-end, HTML5, Ajax, JavaScript, CSS, spa, Git, React.js, "
"[스타트업 근무] 웹 개발 (프론트, 백엔드) 담당자",,"Java, Back-end, 풀스택개발, Front-end, Node.js, JavaScript, React, "
서버 (Javascript / Node.js) 백엔드 개발자 채용,Back-end,"JavaScript, Node.js, Amazon AWS, Back-end, GitHub, 서버관리, "
안드로이드(android) 개발자 채용,App,"안드로이드, Android, 모바일앱개발, "
IOS 개발자 채용,App,"iOS, Swift, restful, SwiftUI, Git, SVN, mvp, MVVM, "
백앤드 S/W개발자(정규직),Back-end,"PHP, MySQL, Python, Java, Android, iOS, MongoDB, Node.js, 풀스택개발, "
(정규직) ReactJS 기반 웹 프로젝트 소프트웨어 엔지니어,Full-stack,"PHP, Python, Java, Android, iOS, MongoDB, Node.js, 풀스택개발, Web Service, Front-end, "
"유명 온라인플랫폼업체, S/W 품질엔지니어",,"iOS, Swift, Android, JavaScript, "
"유명커머스업체, 프론트엔드 개발",Front-end,"Front-end, Git, HTML5, JavaScript, CSS, React.js, Vue.js, HTML5, CSS, SASS, webpack, Grunt, gulp, Browserify, Backbone.js, "
"유명O2O서비스업체, Backend 개발자",Back-end,"Python, Java, Node.js, Django, Celery, Redis, RabbitMQ, Flask, Spring, Rails, "
"대기업계열사 온라인 플랫폼업체, 백엔드개발자",Back-end,"Back-end, Git, Java, spring-framework, SQL, "
"유명 온라인플랫폼업체, JAVA 서버 개발자",Back-end,"Java, 서버개발자, spring-framework, Spring, SpringBoot, MySQL, Maria DB, "
"유명커머스업체, JAVA 서버 개발자",Back-end,"Java, 서버개발자, spring-framework, Spring, SpringBoot, MySQL, Maria DB, NoSQL, Redis, Casandra, MongoDB, "
Web Frontend Engineer,Front-end,"Front-end, CSS3, HTML5, React, Node.js, Git, Javascript(ES6+), "
"초대기업, iOS앱 개발자",App,"iOS, Objective-C, Swift, 아이폰개발자, iPhone, ios 앱개발, WebKit, "
[CryptoParadise] Back-end Junior Developer,Back-end,"REST, Node.js, JavaScript, es6, TypeScript, graphql, aws, Azure, Alibaba cloud, Google Cloud Platform (GCP), Travis CI, azure pipelines, Jenkins, spinnaker, Kubernetes, istio, "
[CryptoParadise] Front-end Junior Developer,Front-end,"TypeScript, es6, React hooks, Next.js, HTML5, graphql, three.js, React, Front-end, blockchain, webgl, "
"[Full-Stack] 백엔드 Django or Java or node.JS, 프론트엔드 React.JS, React native 개발자 모십니다.",Full-stack,"풀스택개발, React, Back-end, Amazon AWS, Python, Django, Java, JavaScript, Android, Node.js, iOS, Front-end, 서버관리, CSS3, MongoDB, MySQL, Git, spring-framework, Spring, "
Senior Frontend Software Engineer 프론트엔드 개발자,Front-end,"Front-end, AngularJS, Node.js, react-native, TypeScript, Redux, Redux-saga, HTML, CSS, vue, Git, "
Junior Frontend Software Engineer 프론트엔드 개발자,Front-end,"Front-end, JavaScript, React, GitHub, Node.js, AngularJS, MySQL, Redux, Redux-saga, "
Senior Backend Software Engineer 백엔드 개발자,Back-end,"PHP, MySQL, Back-end, Lalavel, spring-framework, Node.js, TypeScript, AWS Dynamodb, lambda, Cassandra, Git, "
Frontend Software Engineer (AI tribe),Front-end,"React, Git, CSS, HTML, JavaScript, Vue.js, TypeScript, "
Junior Backend Software Engineer 백엔드 개발자,Back-end,"PHP, Ruby On Rails, MySQL, Back-end, Cassandra, AWS Dynamodb, Node.js, TypeScript, lambda, "
"스타트업 정규 퍼블리셔 신입, 경력직 사원 모집",,"JavaScript, jQuery, HTML5, CSS3, Bootstrap, Front-end, Vue.js, Git, "
"스타트업 정규 개발직 신입, 경력직 사원 모집",,"PHP, JavaScript, MySQL, jQuery, HTML5, CSS3, Bootstrap, vue, Cordova, Firebase, Firestore, React, Front-end, Back-end, 풀스택개발, Git, "
헬스케어 데이터를 함께 만들어갈 개발자를 모십니다!,Full-stack,"PHP, MySQL, Python, 풀스택개발, "
[Wordvice] PHP 개발자 채용,Full-stack,"PHP, Amazon AWS, WordPress, jQuery, MySQL, 풀스택개발, 서버관리, Git, Laravel, devops, "
[Wordvice] 인공지능 기술 및 서비스 개발,AI,"NLP, 머신러닝 NLP, ML/DL, ai, PyTorch, TensorFlow, "
웹(Web) 운영 및 개발 (경력),,"ASP.NET, ASP.NET MVC, asp.net-webforms, Oracle, Bootstrap, jQuery, vue, ASP Classic, dapper, DevExpress, "
Global Development Partner & AI Adtech 스타트업_개발 PM,,"PM, QA/QC, 프로젝트 매니저, 서비스기획자, 모바일기획, "
백엔드(Java Spring boot) 엔지니어,Back-end,"Java, Back-end, Spring, spring-boot, SpringBoot, Amazon AWS, JPA, Hibernate, "
리액트네이티브(react native) 소프트웨어 엔지니어,App,"Android, iOS, Kotlin, Swift, react-native, Flutter, React/React Native, Cross platform App Developement, "
"디자인/퍼블리셔(프론트엔드 전향), 백엔드 모십니다.",,"Android, Back-end, 풀스택개발, Front-end, 퍼블리셔, UI/UX디자인, iOS, React, Node.js, Vue.js, "
AI 개발자,AI,"Python, PyTorch, Linux, NumPy, SciPy, "
벡엔드 개발자 채용,Back-end,"Java, Spring, spring-boot, backend, Git, aws, "
React-Native 개발자,App,"Android, iOS, react-native, JavaScript, TypeScript, Git, React, Front-end, 풀스택개발, "
[정규직] (프론트엔드) 개발자 (신입/경력),,"Android, iOS, "
Android / iOS 개발자 공고,App,"Android, iOS, Front-end, JavaScript, HTML5, HTML&CSS3, Java, Kotlin, Swift, Mobile Applications, Vue.js, "
백엔드(Backend) 개발자,Back-end,"Back-end, Linux, JavaScript, Node.js, MongoDB, RESTful-api, KoaJS, Amazon AWS, Google Cloud Platform (GCP), "
?프론트엔드 개발 인턴,Front-end,"Node.js, Styled-components, Front-end, Electron.js, Git, React.js, WebSocket, REST API, TypeScript, Socket.IO, Redux, Redux-saga, Jest, storybook, lerna, Immer, JavaScript, Amazon AWS, "
함께 성장하는 풀스택 개발자(경력직 5년이상)를 찾습니다.,Full-stack,"Python, Django, Git, Node.js, Back-end, Front-end, 풀스택개발, Amazon AWS, "
개발 인턴사원채용 (정규직 전환예정),Back-end,"백엔드 개발, 백엔드 기술 Java, Spring, Node.js, MySQL, 웹 프론트엔드 개발(HTML5/CSS3/JavaScript/Vue.js), "
[입사보너스 200만원]iOS 앱 개발자를 찾아요 :),App,"iOS, Swift, Swift 개발 경험자, RxSwift, Objective-C, iPhone, ios 앱개발, 아이폰개발자, 아이폰, 모바일앱개발, native app 개발, "
Node.js 풀 스택 개발자 모집,Full-stack,"풀스택개발, Front-end, Back-end, Git, MySQL, Node.js, angular, NestJs, Azure, Full-stack Engineer, "
글로벌 플랫폼 프론트 개발자 인재를 모십니다 (인턴/신입/경력),Front-end,"React, Amazon AWS, Front-end, GitHub, Docker, Git, JavaScript, "
모빌리티 스타트업 / 서버 백엔드 개발자 채용중!,Back-end,"Java, JSP, "
[모아커머스] 프론트엔드 엔지니어 (전문연구요원 가능),Front-end,"JavaScript, HTML5, CSS3, Front-end, 이커머스, "
[홈쇼핑모아] QA 매니저,,"qa, 테스트엔지니어, QA 테스터, "
[신성장]백엔드 엔지니어,Back-end,"백엔드, backend, 서버개발자, 백엔드 개발, 이커머스, "
백엔드 엔지니어 (전문연구요원 가능),Back-end,"백엔드, 서버, RESTful-api, C++, Python, aws, "
[AI/LAB] AI 백엔드 엔지니어 (마케팅 분야),AI,"Back-end, ai, 이커머스, "
[데이터 플랫폼] 데이터 엔지니어 (전문연구요원 가능),,"데이터엔지니어, "
[AI Lab] AI 백엔드 엔지니어 (전문연구요원 가능),,"머신러닝, 파이썬개발자, 서버개발자, "
Android 개발자 (Kotlin),App,"Android, Kotlin, 안드로이드 앱개발, "
웹 프론트엔드 개발자 (ReactJS),Front-end,"JavaScript, React, Redux, webpack & babel, HTML5, CSS3, "
NodeJS/MongoDB 개발자,Back-end,"서버개발자, Node.js, MongoDB, Express, Mongoose, REST API, "
