[Service Management Team] JAVA Developer (경력),AI,"Java, API, Kotlin, Spring, "
Neubility Deep RL Engineer,,"ReinforcementLeaning, reinforcement-learning, C++, Software developement, 강화학습, "
Neubility SLAM/Robotics SW Engineer,,"SLAM, Visual SLAM, robotics, slam-algorithm, localization, "
[신입/경력] Computer Vision & 자율주행 엔지니어,AI,"C++, Python, SLAM, Visual SLAM, "
[맘시터] iOS 엔지니어,AI,"iOS, "
[맘시터] Android 엔지니어,AI,"Android, "
블록체인 지갑 서비스 프론트 개발자,AI,"TypeScript, React, MobX, Go, GitHub, Cosmos SDK, TDD, Mocha, "
(주) 유니메오에서 함께할 (웹) 백엔드 개발자 [과장급]를 찾습니다!,,"JSP, MySQL, Java, JavaScript, jQuery, Back-end, Amazon AWS, "
어플리케이션 개발자,Back-end,"Android, iOS, Node.js, Amazon AWS, Back-end, Front-end, JavaScript, HTML5, aws, kakaotalk-api, "
React 리액트 개발자 채용,,"React, JavaScript, 풀스택개발, Front-end, "
프론트엔드(웹/앱) 개발자 모집(인재선발),AI,"Android, iOS, Kotlin, Python, Node.js, Django, React, "
[데일리펀딩] NO야근/확실한연봉 웹 백엔드 개발자 채용 (back-end),[데일리펀딩] NO야근,"Python, Amazon AWS, Back-end, MySQL, Ubuntu, Django, 오픈소스 라이브러리, 데이터베이스, "
JAVA 백엔드 개발자 경력/신입 모집,AI,"Java, Java Spring, SpringBoot, aws, API, "
웹개발(JAVA) 경력직 모집,,"Java, spring-framework, 웹 백엔드 개발(Java/Spring/Oracle/MySQL), 웹개발자, Linux, "
Android 개발자 / 실.경력에 맞는 평균연봉대우+인센티브,AI,"Android, "
Back-end 개발자 / 실.경력에 맞는 평균연봉대우+인센티브,Back-end,"Python, MySQL, Node.js, Amazon AWS, Back-end, 서버관리, Neo4j, Linux, JavaScript, "
iOS 클라이언트 개발자 채용 / 실.경력에 맞는 평균연봉대우+인센티브,실.경력에,"ios 앱개발, 모바일앱개발, native app 개발, software-engineering, Swift, iPhone, Swift 개발 경험자, RxSwift, Swift3.0, iOS, "
(전문연구요원가능) 인공지능(AI) 연구원 및 개발자 정규직 채용,PyTorch,"Machine Learning, C, deep-learning, PyTorch, computer-vision, image-processing, "
iOS 개발자 영입!,,"iOS, MSSQL/MySQL/MS-Win Server, "
앱 & 웹 개발자 모집,Node.js,"Front-end, Back-end, JavaScript, MySQL, Node.js, HTML5, React, Amazon AWS, "
Full Stack Software Engineer,,"Ruby On Rails, JavaScript, Vue.js, Front-end, full stack, PostgreSQL, "
유니티 3D Pointcloud/AR 개발자 모집,AI,"Unity 3D, 유니티, ar, pointcloud data, Pointcloud Library, unity, vr, 클라이언트 개발, "
모빌테크 기술개발팀 센서 융합 연구원 모집,AI,"센서융합, 자율주행, 로봇자율주행, localization, calibration, lidar, ros, "
모빌테크 기술개발팀 SW 개발 신입/경력 사원 채용,,"SLAM, Visual SLAM, ros, sensor-fusion, lidar, 메카트로닉스, localization, "
"웹 (PHP, Laravel) 개발자를 모집합니다.",AI,"JavaScript, jQuery, CSS, HTML, Git, MySQL, PHP, "
iOS/Android App React Native 프론트엔드 개발자,React/React,"react-native, react-native 앱 개발, React/React Native, 리액트네이티브, ios 앱개발, 안드로이드 앱개발, 개발자, "
"응용소프트웨어 JAVA 개발자 / 웹프로그래머 (경력 1인), APP 개발자(안드로이드, 아이폰) (신입 1인)",,"Back-end, Front-end, 풀스택개발, Java, "
IOS 개발자 정규직 모집(경력),AI,"iOS, Swift, Xcode, ios 앱개발, "
"(주) 앱플러 서버 백엔드, 웹 프론트 개발자 모집",AI,"#HTML5, #CSS3, C#, #웹표준, #컨텐츠관리, #php, #MySQL, #AJAX, #웹프로그래머, "
(주)앱플러 안드로이드 개발자(경력) 모집,AI,"Java, Android, Kotlin, "
백엔드 개발자 1명 (경력 3년 이상),AI,"Python, Django, Amazon AWS, "
"[올림플래닛] 백엔드 개발(golang, python) 경력 3년 이상","golang, p","Go, golang, Docker, Kubernetes, Python, Node.js, Back-end, Amazon AWS, 서버관리, MSA, Serverless Architecture, RESTful-api, Google Cloud Platform (GCP), "
데이터 사이언스 및 엔지니어링,AI,"MySQL, Python, R, tableau, "
[화룡점정 임박] 파도팀의 마지막 퍼즐 조각이 되어주실 킹갓제너럴 개발자님 모십니다.,Security,"JavaScript, React.js, react-native, "
머신러닝/인공지능 개발 연구,AI,"Python, Java, C++, TensorFlow, PyTorch, "
[어플리케이션(Android) 개발자 채용],AI,"Android, "
인공지능으로 직무전환을 원하시는 프론트엔드 개발자 모십니다.,,"React, JavaScript, TypeScript, Front-end, "
인공지능으로 직무전환을 원하시는 백엔드 개발자 모십니다.,AI,"Kubernetes, Docker, NoSQL, Django, Python, Linux, "
[링크샵스] 개발팀 리더 채용,AI,"aws, Node.js, React.js, Vue.js, db, PostgreSQL, B2B플랫폼, 패션, "
풀스택개발자,AI,"풀스택개발, "
데이터 사이언티스트,AI,"Python, Amazon AWS, GitHub, Machine Learning (머신러닝), Fraud Detection, "
플레이키보드 iOS 개발자를 모십니다(산업기능요원 보충역 지원가능).,AI,"iOS, Swift, Xcode, ios 앱개발, 아이폰개발자, 모바일앱개발, 아이폰, iPhone, "
사물인터넷(IoT) 개발자 모집 - 신입 가능,AI,"Java, Python, Android, JavaScript, Node.js, 아두이노, "
프론트엔드(Web) 개발자,AI,"web, React.js, Vue.js, AngularJS, "
프론트엔드(App) 개발자,AI,"Android, iOS, Flutter, Dart, Kotlin, Swift, XD, "
네트워크 엔지니어 경력직 채용,AI,"Mobile Edge Computing, Network Packet Broker, "
[경력/백엔드 개발자] 신발 사이즈 추천 서비스 Perfitt에서 백엔드 Lead 를 모십니다,,"Back-end, Node.js, Amazon AWS, MongoDB, JavaScript, API, eCommerce, fulfillment, "
[펄핏]신발 사이즈 추천 서비스 Perfitt 솔루션 파트 Full-stack 개발자,[펄핏]신발,"Back-end, MongoDB, 아키텍쳐, REST API, Node.js, Amazon AWS, JavaScript, Git, Python, React, "
펄핏의 인공지능을 똑똑하게 만들어주실 Data Team Lead를 모십니다,MongoDB,"MongoDB, Amazon AWS, Git, Python, Machine Learning, TensorFlow, ComputerVision, Data analytics, "
신발 사이즈 추천 서비스 Perfitt - Senior Data Analyst,신발 사이즈,"Machine Learning, TensorFlow, keras, deep-learning, Python, Data analysis, image-processing, "
대전 지역 기업 레드윗 전문연구원 개발자 및 일반 개발 팀원 모집합니다.,"end, 풀스택개발","Node.js, JavaScript, Back-end, Front-end, 풀스택개발, React, Blockchain Developers, "
[경력] 프롭테크 기업 홈버튼 웹개발자 채용 중,,"Java, jQuery, JavaScript, Front-end, HTML5, JSP, MySQL, "
"Senior Software Engineer, Computer Vision",AI,"C, C++, 기계공학, Open GL, FEM, 3D, CFD, 딥러닝, "
"Senior Software Engineer, Backend",,"Node.js, MySQL, Amazon AWS, Back-end, 풀스택개발, JavaScript, 서버관리, React, "
"[Full-Stack] 경력직 백엔드 Node.js, 프론트엔드 React.js 풀스택 개발자 모십니다.",React.j,"Node.js, express.js, MySQL, React.js, Amazon AWS, Android, Git, Front-end, Back-end, 풀스택개발, Redis, MongoDB, Linux, "
성장과 혁신의 아이콘 ㈜보이스루 Data Engineer 공개채용,AI,"Java, Kotlin, Scala, Python, SQL, spark, Hadoop, aws, Kubernetes, data, Data Engineering, "
웹 백엔드 개발자 (Web Back-end Developer),웹 백엔드,"Back-end, Go, Redis, Python, "
[지빅스] Frontend Developer,AI,"JavaScript, CSS3, HTML5, React, Node.js, photoshop, "
php 웹프로그래머 (과장급) 를 모집 합니다.,AI,"PHP, MySQL, Redis, "
[경력/서버개발자] 관리자페이지 유지보수 및 관리,"React, spring","Java, Node.js, jQuery, Front-end, React, spring-boot, "
flutter 앱 개발자,AI,"Android, iOS, Flutter, "
"Unity3D AR, MR 서비스 개발자 채용",AI,"Unity 3D, AR/VR, Unreal, shader, "
세종큐비즈(주) PHP 웹 개발자 공고,Back-end,"PHP, MySQL, Node.js, Front-end, Back-end, Git, "
모바일 앱 개발자 / Mobile-App Developer : 팬딩을 소비자와 더 가까이 이어주실 앱 개발자를 찾고 있어요!,모바일 앱,"React, ReactNative, react-native, React.js, React.js, Vue.js, webpack, Redux, esnext, "
웹 프론트엔드 개발자 (React) (신입/경력),,"Front-end, React, JavaScript, "
AI 솔루션 개발자 (인턴 / 신입 / 경력자 / 프리랜서 가능),Java,"Java, Python, C++, Back-end, Amazon AWS, TensorFlow, keras, YOLO, NumPy, PyTorch, jupiter, gpu, "
프런트엔드 개발 (인턴/신입/경력/프리랜서),개발 ,"Android, Java, JavaScript, jQuery, Python, MySQL, HTML5, Git, CSS3, GitHub, React, Bootstrap, Node.js, Amazon AWS, MongoDB, Front-end, 풀스택개발, HTML, PHP, AngularJS, "
벡엔드 개발자 채용 (인턴/신입/경력/프리랜서),채용 ,"Java, jQuery, Python, AngularJS, Node.js, MongoDB, MySQL, JSP, Back-end, Git, Apache, Amazon AWS, 풀스택개발, 서버관리, GitHub, React, Bootstrap, "
SW QA Engineer(QA 엔지니어),"assurance, testing","SW QA, QA 테스터, 소프트웨어테스트, quality-assurance, testing, software-testing, ISTQB, 테스터, 모바일, qa, "
솔루션 경력 개발자,,"Java, spring-framework, Maria DB, 백엔드, 자동화, 테스트 자동화, API, 개발 유지보수, 유지보수, 백엔드개발자, backend developer, 백엔드 개발, 백오피스, "
보안전문가,정보보안,"정보보안, 보안솔루션, security, 웹 보안, 정보보호, 리버스 엔지니어링, 모의해킹, 소프트웨어 취약점, 취약점 분석, 보안취약점, "
래브라도 서비스 엔진 개발,"AWS, Front","Java, jQuery, MySQL, JavaScript, HTML5, Amazon AWS, Front-end, Back-end, 서버관리, nginx, Apache Tomcat, "
웹서비스 프론트 개발,,"Front-end, 취약점 분석, 소프트웨어 취약점, "
Unity 개발자,AI,"Android, iOS, C#, Unity 3D, aws, "
건강비밀에서 웹 개발자를 모십니다!,AI,"Java, Spring, Tomcat, algorithm, MySQL, "
3D 테크니컬 아티스트,,"artificial-intelligence, Machine Learning, deep-learning, "
[신입] 프론트엔드 개발자,,"vue.js, js, React, Front-end, GitHub, Git, Python, "
[신입] 백엔드 개발자,"AWS, 소프트웨어아키텍처","Back-end, GitHub, devops, Git, Amazon AWS, 소프트웨어아키텍처, Python, continuous-integration, continuous-delivery, continuous-deployment, Docker, 서버관리, Kubernetes, GitOps, CircleCI, ArgoCD, Amazon EKS, Flask, Celery, MongoDB, "
[경력] 프론트엔드 개발자,,"Vue.js, js, React, Front-end, GitHub, Git, Python, "
[경력] 백엔드 개발자,"AWS, 소프트웨어아키텍처","Back-end, GitHub, devops, Git, Amazon AWS, 소프트웨어아키텍처, Python, continuous-integration, continuous-delivery, continuous-deployment, Docker, 서버관리, Kubernetes, GitOps, CircleCI, ArgoCD, Amazon EKS, MongoDB, Flask, Celery, "
리액트 네이티브 개발자,,"React, react-native, JavaScript, Android, iOS, React hooks, "
[신입] 머신러닝 연구원,AI,"Python, Tensorflow, pytorch, "
PHP/웹개발 채용 공고,AI,"PHP,RDB, "
[패션 AI] 딥러닝 엔지니어,AI,"Python, MySQL, Amazon AWS, "
[패션 AI] Python 백엔드 개발자,,"Python, Amazon AWS, Back-end, GitHub, MySQL, TensorFlow, PyTorch, "
인공지능 학습데이터 매니징 SaaS Zelly의 백엔드를 개발하실 분을 찾습니다!,AI,"Python Django, Python, TensorFlow, PyTorch, "
DBA,AI,"dba, "
모바일개발자 (iOS / Android),AI,"Android, iOS, "
시스템 관리자 (SA팀),AI,"System Engineer, sa, "
"인플루언서 플랫폼 트렌드잇플 Front-End 개발자님을 모십니다!! (React.js,Next, Typesrcipt)","모십니다!! (React.js,Ne","React.js, Next.js, TypeScript, 웹 프론트엔드 개발(HTML5/CSS3/JavaScript/Vue.js), Amazon AWS, GitHub, Git, REST API, MongoDB, swagger, Styled-components, CI/CD, Context API, storybook, cypress, "
"[SIZL 개발부 (송도)] Front-end//Back-end 경력, 신입 모집",React,"React, JavaScript, Node.js, HTML5, Git, CSS, Front-end, React/React Native, REST API, "
시스템 개발 S/W 엔지니어 모집,AI,"서버개발, iot, mqtt, HTTP, jQuery, Node JS, PHP, MySQL, Amazon AWS, Java/JSP, "
자율주행/영상처리/빅데이터/서버/앱 분야 개발자 모집,Android,"Android, iOS, Java, PHP, Node.js, JSP, AngularJS, MySQL, MongoDB, Python, rtos, "
[Java / Spring / Node.js] 서버/백엔드 경력 개발자 채용,,"Android, Java, C++, Node.js, Back-end, Spring, "
[경력] 데이터 엔지니어/데이터 사이언티스트 (전직/보충역 산업기능요원 가능),사이언티스트 (전직,"eCommerce, 이커머스, 쇼핑몰, JavaScript, Javascript(ES6+), Git, aws, Amazon AWS, Back-end, data, data-analysis, Database, 머신러닝, 백엔드 개발, rdbms, RDBMS에 대한 이해, NoSQL, Python, Azure, GCP, agile, 데이터엔지니어, 데이터사이언티스트, "
[경력] 프로덕트 오너,Amazon AWS,"eCommerce, 이커머스, 쇼핑몰, Git, HTML5, GitHub, Amazon AWS, Back-end, 풀스택개발, Front-end, 서버관리, devops, devops engineer, server, Data Science, po, Product owner, product-management, 프로젝트 관리, 프로젝트 기획, "
[경력] 웹/프론트엔드 엔지니어 (전직/보충역 산업기능요원 가능),엔지니어 (전직,"eCommerce, 이커머스, 쇼핑몰, React, Redux, nodejs, MongoDB, MySQL, aws, JavaScript, Git, HTML5, CSS3, GitHub, Amazon AWS, Back-end, 풀스택개발, Front-end, 서버관리, Javascript(ES6+), devops, devops engineer, server, "
iOS 서비스 개발자 채용 (경력 4년 이상),,"iOS, Objective-C, Swift 개발 경험자, iPhone, ios 앱개발, 아이폰개발자, Swift, 모바일앱개발, "
(곰앤컴퍼니 자회사) JAVA 개발자 채용,,"Java, MySQL, Back-end, "
심플리오 풀스택/백엔드 개발자,"end, Amazon","Python, PHP, Back-end, 풀스택개발, Front-end, Amazon AWS, Node.js, "
"문화기획자 무브컬쳐 백엔드 개발자, 프론트엔드 개발자 공개채용",AI,"웹 프론트엔드 개발(HTML5/CSS3/JavaScript/Vue.js), 백엔드 기술 Java, Spring, Node.js, MySQL, "
연구소 개발 파트,,"Python, MySQL, Java, C++, Node.js, Amazon AWS, Back-end, Git, "
(채용정보) 국내유망벤처 쥬니어 파이썬 개발자 - 여러명 채용,(채용정보) 국내유망벤처,"Python, Back-end, 파이썬, "
"프론트엔드 개발자 [신입, 경력]",AI,"iOS, Android, React.js, ReactNative, "
웹 프론트 개발자 (경력),"MongoDB, Vue","Node.js, Amazon AWS, Redis, nginx, MongoDB, Vue.js, Front-end, Back-end, REST API, nuxt.js, ExpressJS, Git, Javascript(ES6), JavaScript, "
웹 백엔드 개발자 (경력),"MongoDB, Vue","Node.js, Amazon AWS, Redis, nginx, MongoDB, Vue.js, Front-end, Back-end, REST API, nuxt.js, ExpressJS, Git, Javascript(ES6), JavaScript, "
[크라운랩스] 웹서비스 개발자 채용(신사업 분야),웹서비스,"Node.js, Amazon AWS, Back-end, Front-end, 풀스택개발, Python, Git, GitHub, JavaScript, Data Science, data-analysis, 빅데이터분석, 빅데이터 분석/인프라/가시화, "
신사업 개발(웹서비스 개발) 경력자 채용,개발(,"Node.js, Amazon AWS, Back-end, Front-end, Git, GitHub, Python, 서버관리, data-analysis, 빅데이터 분석/인프라/가시화, 빅데이터 엔지니어, JIRA, 개발언어, "
웹서비스(신사업) 개발자 경력직 채용,웹서비스(,"Python, Node.js, Amazon AWS, Back-end, Front-end, Git, Big Data, data-analysis, QA/QC, "
(주)반달소프트 2021년 상반기 펌웨어 개발자 채용,AI,"펌웨어개발, "
(주)반달소프트 2021년 상반기 백엔드 개발자 채용,MySQL,"백엔드 기술 Java, Spring, Node.js, MySQL, 백엔드 개발, 서버개발자, "
"웹 (백엔드, 서버) 개발자를 모집합니다.",,"PHP, MySQL, Amazon AWS, Back-end, "
백엔드 개발자 경력직채용,,"Python, Django, Flask, Back-end, "
(주)멋쟁이사자처럼 강사채용,AI,"Python, Django, jupyter notebook, TensorFlow, 딥러닝, 머신러닝, 인공지능, "
Cloud Service(AWS) 개발자,,"Amazon AWS, Back-end, 서버관리, "
소프트웨어 엔지니어 경력자 채용,Git,"jQuery, JavaScript, MySQL, Git, full-stack development, Full-stack Engineer, "
(주)엔티엘헬스케어 Frontnd개발자(SW개발팀) 채용,,"React, JavaScript, CSS, HTML, Front-end, framework, javaspring, "
[윌라] 프론트엔드 개발자,,"Git, Front-end, GitHub, CSS, HTML, JavaScript, "
[윌라] iOS 앱 개발자,,"iOS, Objective-C, ios 앱개발, iPhone, 아이폰, ReactNative, "
[윌라] 안드로이드 앱 개발자,AI,"Android, REST API, ReactNative, Kotlin, 안드로이드개발, 안드로이드 앱개발, Android앱개발, "
[윌라] 백엔드 개발자,,"Python, MySQL, Back-end, 서버관리, Amazon AWS, Git, GitHub, "
안드로이드 개발 (경력직),AI,"Android, Java, "
[대전 스타트업] 로봇 S/W 개발자 신입/경력 모십니다.,AI,"Python, C++, Linux, 로봇제어, 로봇자율주행, 로봇 알고리즘, "
"뷰티헬스케어 시장을 선도하는 기업, 에포터에서 프론트 개발자를 모십니다.",,"Front-end, Vue.js, React, "
안드로이드 개발자를 모십니다.,안드로이드 앱개발,"안드로이드 앱개발, Android앱개발, 안드로이드, 코틀린, RxJava, MVVM, retrofit2, google-guice, Java8, AAC ViewModel, android-recyclerview, "
[업계최상협의/희망연봉입사] (주)멸치 백엔드 개발자(경력) 채용,"end, JavaScript","spring-boot, Spring, MySQL, Java, Back-end, JavaScript, jQuery, React, Vue.js, "
[업계최상협의/희망연봉입사](주)멸치 IOS/안드로이드 개발자 채용,Android,"Android, Kotlin, iOS, Java, jQuery, Swift 개발 경험자, Swift, Git, MVVM, rxcocoa, RxSwift, "
백엔드 개발자 채용공고 - 1등 CRM SaaS 스타트업 바디코디,Java,"Java, Node.js, JavaScript, Back-end, Amazon AWS, Front-end, MariaDB, Spring, spring-boot, Mobile Service, "
ERP 개발 및 운영 (C# .NET),AI,".NET, ASP.NET, C#, WCF, IIS, "
[ST Unitas] System Engineer(경력) 모집,,"Apache, nginx, aws, Linux, tcp-ip, lighttpd, autoscaling, replication, "
[ST Unitas] iOS 개발 담당자(팀원급),Unitas] ,"ios 앱개발, Linux, Swift, ReactiveX, RIBs, 파이어베이스, ios-sdk, cocoapods, RxSwift, MVVM, autolayout, snapkit, alamofire, Clean Architecture, grpc, "
(급구)전자문서시스템 JAVA개발,AI,"React, Vue.js, Django, "
Back-end (java)개발자 채용공고,Back-end,"Vue.js, React, Back-end, JavaScript, CSS, HTML5, "
Front-end 개발자 채용공고,Front-end,"Vue.js, 웹 프론트엔드 개발(HTML5/CSS3/JavaScript/Vue.js), React, Front-end, "
iOS 개발자 채용,AI,"iOS, "
Android 앱 개발자(산업기능요원 가능),AI,"Java, Kotlin, RxJava, RXKotlin, MVVM, mvp, mvc, retrofit2, jetpack, "
플랫폼 백엔드 개발자 채용(산업기능요원 가능),Back-end,"Back-end, Azure, aws, ASP.NET Core, mvc, ASP.NET MVC, Git, Entity Framework, Spring, Java, "
iOS 앱 개발자(산업기능요원 가능),AI,"iOS, alamofire, Swift, Git, autolayout, RxSwift, MVVM, mvc, "
프론트엔드 개발자 채용(산업기능요원 가능),,"Front-end, JavaScript, React, angular, Vue.js, Git, "
개발 총괄 책임자-CTO,AI,"CTO, "
"ReactJs, ReactNative, NodeJs, PHP","Git, Front","PHP, MySQL, Amazon AWS, Node.js, Git, Front-end, 풀스택개발, Back-end, JavaScript, React, GitHub, CSS3, HTML5, Bootstrap, 소프트웨어아키텍처, "
[아지앙스 코리아] 경력직 풀스텍 개발자 채용,AI,"Java, PHP, MySQL, Python, CSS3, "
앱 개발자,& Dart,"Android, iOS, Swift, RxSwift, Flutter, Flutter & Dart, Kotlin, 모바일앱개발, MVVM, Git, react-native, ReactNative, Android앱개발, ios 앱개발, 안드로이드 앱개발, 안드로이드개발자, 코틀린, native app 개발, reactive-programming, "
머신러닝 엔지니어 [산업기능요원 복무 가능],"머신러닝, keras","PyTorch, machine-learning, 기계학습, 딥러닝, 인공지능, 머신러닝, keras, TensorFlow, artificial-intelligence, "
시니어 프론트엔드(frontend) 개발자,,"iOS, Android, react-native, Redux, Front-end, "
"웹 기획/개발자, 빅데이터, 모바일 기획/개발자",AI,"PHP, Java, MySQL, Python, "
React 프론트엔드 개발자 채용,,"React.js, Styled-components, CSS, "
Client Engineer,Front-end,"Android, Kotlin, reactive-programming, Git, GitHub, Front-end, 소프트웨어아키텍처, dagger-2, iOS, Swift, RxJava, "
Server Software Engineer,"programming, Kotlin","MySQL, JavaScript, Node.js, Java, reactive-programming, Kotlin, Elasticsearch, ELK, Amazon AWS, Back-end, "
빅데이터/웹크롤링 개발 및 연구직 채용,,"서버관리, 빅데이터, 데이터베이스, dba, ms-sql, MySQL, 데이터마이닝, NoSQL, "
백스테이션에서 Front-end 개발자를 찾습니다.,React,"Front-end, JavaScript, Vue.js, React, Sass/scss, Laravel, 풀스택개발, "
경매이징에서 Back-end(PHP) 개발자를 찾습니다.,경매이징에서 Back,"PHP, MySQL, NoSQL, Laravel, Back-end, 풀스택개발, 서버관리, "
3D OpenGL 렌더링 엔진 개발 (C·C++),OpenGL 렌더,"Qt, C++, C, webgl, fbx, animation, v-ray, Amazon Redshift, render, Open GL, renderer, rigid-bodies, "
"C·C++, Qt GUI 데스크탑 응용 프로그래머",AI,"GitHub, Qt, simulation, C++, Git, CMake, "
"3D 시뮬레이션 (옷, 강성체, FEM) 및 충돌 처리 엔지니어 모집",Security,"3D, Open GL, Qt, CMake, OS X, Linux, rigid-bodies, C++, collision, simulation, "
인프라(팀원),AI,"aws, Python(파이썬), MariaDB, CatcI, Nagios, zabbix, "
DevOps Engineer,Machine Learning,"Python, C++, shell-script, Machine Learning, deep-learning, data-management, "
"Software Engineer - C++, Application",Software Engineer,"C++, 3d-graphics, computer-vision, "
Research Engineer - Robotics Perception,Research Engineer,"Python, C++, PyTorch, TensorFlow, scikit-learn, "
"Software Engineer Intern - C++, Application",AI,"C++, OOP, "
Research Engineer Intern - Machine learning,Research Engineer,"Python, scikit-learn, TensorFlow, PyTorch, "
금성출판사 계열사 매쓰클라우드 안드로이드 앱 개발자,AI,"Android, Kotlin, 안드로이드 앱개발, RxJava, retrofit2, OkHttp3, "
금성출판사 계열사 매쓰클라우드의 Node.js 백엔드 개발자 채용,"서버관리, Ubuntu","Back-end, JavaScript, Node.js, MongoDB, 서버관리, Ubuntu-18.04, "
금성출판사 계열사 매쓰클라우드 React 프론트엔드 개발자,,"Front-end, React, CSS, HTML, JavaScript, TypeScript, "
FrondEnd / BackEnd 개발자 모십니다.,"HTML5, Git","jQuery, Python, MySQL, Back-end, JavaScript, HTML5, Git, CSS3, Front-end, CSS, Bootstrap, HTML, "
인공지능 개발 채용,"NLP, deep","Python, TensorFlow, artificial-intelligence, machine-learning, NLP, deep-learning, 인공지능, 딥러닝, 기계학습, 머신러닝, keras, Machine Learning, PyTorch, "
외식 배달 주문 서비스 개발 및 운영( JAVA 웹개발),,"Java, jQuery, JavaScript, Back-end, Front-end, "
"웹개발자(Java,JavaScript 프로그래밍 경력 5년이상),원격근무 불가",프로그래밍 경,"Java, Back-end, JavaScript, spring-framework, jQuery, Vue.js, Bootstrap, Node JS, cloud, Ajax, web-frontend, "
소프트웨어 엔지니어 (백엔드),,"Java, Python, Amazon AWS, Back-end, 서버관리, "
모바일 개발자,AI,"Kotlin, 코틀린, Swift, Swift 개발 경험자, "
[핑퐁] 제품 개발자 (Backend Software Engineer),AI,"Java, Python, devops, Machine Learning, "
[블림프] 그로스 데이터분석가,data-analysis,"데이터분석, 데이터마이닝, 데이터사이언스, data-analysis, Data Science, R 통계, SQL, "
인공지능 챗봇 플랫폼 개발자 모집(경력),"AWS, HTTP","Front-end, Back-end, GitHub, Amazon AWS, HTTP, RDBMS(oracle), WebSocket, NoSQL, "
인공지능 QA개발 엔지니어 모집(신입/경력),"Learning, NLP","PyTorch, TensorFlow, 인공지능, 딥러닝, 머신러닝, Machine Learning, NLP, deep-learning, artificial-intelligence, ai, Java, "
산업기능요원 병역특례 개발자 모집(보충역/현역),병역특례,"Git, GitHub, 인공지능, AI(인공지능), 머신러닝, artificial-intelligence, NLP, deep-learning, Big Data, Machine Learning, Data Science, PyTorch, TensorFlow, 딥러닝, 기계학습, "
인공지능 프론트엔드 개발자 모집(경력),인공지능 프,"Python, Tensorflow, pytorch, AI(인공지능), Deep Learning (딥러닝), Machine Learning (머신러닝), NLP, artificial-intelligence, ai, Java, 프론트엔드, REST API, HTTP, OAuth, JavaScript, CSS, HTML, 프론트엔드 개발(ReactJS, VueJS), TypeScript, React, Amazon AWS, Front-end, "
전문연구요원 병역특례 개발자 모집,artificial-intelligence,"Git, GitHub, 인공지능, AI(인공지능), 머신러닝, artificial-intelligence, NLP, deep-learning, Big Data, Machine Learning, Data Science, PyTorch, TensorFlow, 딥러닝, 기계학습, "
프론트앤드 안드로이드 앱 개발자 (Front-end / Android / Flutter),개발자 (Front-end / And,"Android, 안드로이드 앱개발, 안드로이드, iOS, Flutter, 프론트엔드 개발, Front-end, 모바일앱개발, Android앱개발, ios 앱개발, 어플리케이션 개발, "
"?머신러닝 엔지니어 (시니어, 주니어, 인턴)","Learning, computer","Python, Tensorflow, pytorch, deep-learning, Machine Learning, computer-vision, gan, contents, "
"모바일 보안 솔루션 개발 (병특 가능, 산업기능요원 보충역or전직, 전문연구요원)","병특 가능, 산업기능요원 보","Android, Java, Python, C++, iOS, C, dalvik, Gradle, Objective-C, Swift, Javascript(ES6), JSP, 컴파일러, compiler, llvm, "
백엔드 개발자 (전문연구요원 가능),AI,"Django, Node.js, Linux, dockerizing, aws, TDD, React.js, "
프론트엔드 개발자 (전문연구요원 가능),AI,"HTML5, CSS3, scss, es2015, es2016, CROSS BROWSING, Vue.js, AngularJS, Node.js, Grunt, gulp, webpack, Browserify, Django, bi시스템, 웹서비스보안, React, React.js, "
