프론트엔드 앱 개발자(3년차 이상) 채용 공고,,"프론트엔드 개발, 풀스택개발, 개발자, react-native, TypeScript, graphql, apollo, 모바일 앱 개발, 프론트엔드, Git, 프론트엔드개발자, "
Front end 개발자 채용 (모집),,"JavaScript, CSS, HTML, AngularJS, React, Front-end, vue, "
Back end 개발자 채용 (모집),Back ,"NoSQL, Amazon AWS, Node JS, golang, RDBMS(oracle), RESTful-api, Amazon EC2, AWS Lambda, AWS Dynamodb, Amazon S3, "
iOS 가족을 모십니다~,AI,"iOS, Swift 개발 경험자, "
[WIPPY/QUAT] 데이터를 분석해 주실 데이터 분석가를 모십니다!,분석해 주실,"데이터분석, 데이터사이언스, data-analysis, Data Modeling, machine-learning, 빅데이터, 데이터, 통계학, 데이터마이닝, 빅데이터 마이닝, data analyst, R, Big Data, Datamining, Data Science, R 통계, R데이터분석, bigdata, "
[WIPPY] 소셜 앱 매출 1위 위피를 개발해 주실 백엔드 개발자를 모십니다!,AI,"Python, Django, Django REST framework, Amazon AWS, Back-end, PostgreSQL, Redis, RabbitMQ, Elasticsearch, MongoDB, nginx, Java, PHP, Node.js, Kotlin, Spring, spring-framework, Ruby On Rails, backend, backend developer, REST API, RESTful-api, API, JavaScript, "
QA Tester 채용,AI,"QA 테스터, "
Backend Developer 채용,AI,"Java, Kotlin, Python, Go, Ruby, Amazon AWS, "
Frontend Developer 채용,CSS,"frontend, web, HTML, CSS, JavaScript, Vue.js, AngularJS, React.js, "
Backend Engineer(Search/ML),AI,"Python, Go, Apache, "
Android Developer 채용,AI,"Android, "
DevOps Engineer 채용,AI,"Docker, CI/CD, INFRA, "
Data Analyst 채용,AI,"SQL, Firebase, GA, Appsflyer, Amplitude, "
Web Developer [Solver Team] 채용,AI,"reactjs, TypeScript, Nextjs, Jenkins, "
iOS Developer 채용,AI,"iOS, "
파이썬/장고 웹 개발자,Python,"Python, Django, PostgreSQL, Back-end, 서버관리, JavaScript, Git, ELK, Docker, Amazon AWS, "
[글로벌 1백20만 다운로드 소셜 서비스_신사업] 서버엔지니어 경력 채용,Security,"NoSQL, iscjp, mcdba, MCSE, aws, google gcp, messaging, server-side development, Java, Python, Big Data, Database, micro service architecture, Back-end, Amazon AWS, MySQL, PHP, "
[글로벌 1백20만 다운로드 소셜 서비스 둥글] 웹 프론트 엔지니어 경력 채용,,"React, HTML, CSS, JavaScript, 크로스브라우징, 반응형웹, Front-end, HTML5, "
[글로벌 1백20만 다운로드 소셜 서비스 둥글] 신입 서버엔지니어 채용,Security,"Java, MySQL, Node.js, Amazon AWS, google gcp, Back-end, 서버관리, GitHub, "
Back Office 개발,AI,"JavaScript, TypeScript, Retool(리툴), REST API, "
[전문연구요원/iOS] Swift/AR/VR,AI,"iOS, Swift, Apple ARKit, AR/VR, Realm, Eureka, alamofire, 디자인패턴, MVVM, LayoutKit, "
[전문연구요원/Research] Computer Vision/Deep Learning/SLAM,Computer Vision/Dee,"컴퓨터비전, 머신러닝, 딥러닝, SLAM, 3D mapping, image-processing, computer-vision, computer-graphics, object-detection, deep-learning, machine-learning, CNN, 3D CNN, "
[전문연구요원/Frontend] Angular/3D/WebGL/Computer Graphics,,"JavaScript, TypeScript, angular, React, 3D, webgl, Open GL, HTML, CSS, canvas, computer-graphics, "
[전문연구요원/Backend] AWS/Ruby/Elastic Stack,Backend] AWS/Rub,"Ruby On Rails, aws, Elastic stack, Terraform, devops, CI/CD, REST API, Docker, Kubernetes, Kibana, Amazon AWS, Elasticsearch, "
[서핏] 프론트엔드 엔지니어 (Vue.js),AI,"Vue.js, Javascript(ES6), Sass/scss, Google Chrome Extension, Git, webpack, REST API, "
프론트엔드 개발자 (Front-end 개발자),프론트엔드 개발자,"Front-end, Vue.js, Cordova, WordPress, .NET, SQL, ReactNative, React.js, "
Data Engineer (신입/경력),AI,"Python, SQL, PostgreSQL, MariaDB, MySQL, Airflow, jupyter notebook, SQLAlchemy, pytest, GitHub, Yona, Git, "
Machine Learning Engineer,,"Back-end, Amazon AWS, Machine Learning, "
Front-end Engineer (경력/신입),Front-end,"JavaScript, Front-end, React, Git, "
서버개발자 경력 채용 - 에듀테크 스타트업 오누이,서버개발자 경력,"서버관리, MySQL, Node.js, Amazon AWS, Back-end, MongoDB, Redis, Git, 풀스택개발, "
Front-end 개발자,Front-end,"Front-end, TypeScript, Node.js, Cordova, "
안드로이드 개발,"안드로이드, iOS","Java, Back-end, 서버관리, Front-end, 안드로이드, iOS, ios 앱개발, 모바일앱개발, 하이브리드앱, 웹개발, 하이브리드웹앱, 백엔드개발, 프론트개발, 개발, 풀스택, "
인프라 담당,"모바일앱개발, 하이브리드앱","Java, Back-end, 서버관리, Front-end, 모바일앱개발, 하이브리드앱, 웹개발, 하이브리드웹앱, 백엔드개발, 프론트개발, 개발, 풀스택, 인프라, aws, 클라우드, INFRA, Naver Cloud, "
웹퍼블리셔 채용,"publishing, 포토샵","UI/UX, 웹퍼블리싱, 웹 퍼블리셔, web-publishing, 포토샵, HTML, CSS, 반응형 웹, 모바일디자인, HTML&CSS3, webdesign, web-frontend, publishing, 웹 퍼블리싱, 웹퍼블리싱(jQuery, CSS, HTML, AngularJS, VueJS), "
Java 웹개발,,"Java, Back-end, 서버관리, Front-end, "
시니어 서버 개발자,AI,"서버개발자, 서버API, Phyton, PHP, Node.js, Amazon AWS, Django, ci, Ruby On Rails, Google Cloud Platform (GCP), "
[신사업] TypeScript BackEnd 엔지니어,,"백엔드개발자, Back-end, TypeScript, nest.js, Amazon AWS, typeORM, MySQL, Redis, Elasticsearch, puppeteer, axios, cheerio, monorepo, Jest, Node JS, Docker, Kubernetes, cypress, "
[신사업] Angular Front-End 엔지니어,신사업] Angular,"angular, 프론트엔드 개발, Front-end, Ionic, capacitor, HybridApp, nest.js, monorepo, Jest, cypress, es2015, TypeScript, Vue.js, React, unit-testing, e2e-testing, Back-office-admin, 페어프로그래밍, 코드리뷰, "
"스마트 모빌리티, MaaS 플랫폼 서비스를 함께 만들어갈 iOS 어플리케이션 개발자를 모십니다.",AI,"iOS, Swift, 모바일앱개발, iPhone, Xcode, 아이폰, native app 개발, "
[어뮤즈] 백엔드 개발 담당,AI,"백엔드 개발, "
[어뮤즈] 웹 프론트엔드 개발,AI,"Vue.js, 웹프론트엔드 개발, deploy, es6, JavaScript, webpack, ssr, ProgressiveWebApp(PWA), Git, CI/CD, nuxt.js, Agile Scrum, seo, Responsive web, CROSS BROWSING, "
블록오디세이 경력직 React / React Native / JavaScript개발자 모집 공고,,"풀스택개발, JavaScript, React, react-native, "
블록오디세이에서 5-7년차 블록체인 개발자를 모집합니다.,AI,"blockchain, Node.js, JavaScript, golog, Solidity, Linux, UNIX, "
[경력] 스마트팜 웹서비스 - 백엔드/풀스택 엔지니어,AI,"artificial-intelligence, 머신러닝, Machine Learning, 딥러닝, deep-learning, 데이터분석, Data Science, machine-learning, image-recognition, computer-vision, image-processing, object-detection, 영상처리, 딥러닝이미지분석, 컴퓨터비전, 스마트농업, 스마트팜, Smart Farm, PyTorch, TensorFlow, Object Classification, keras, CNN, aws, Amazon AWS, nodejs, Node.js, TypeScript, Express, typeORM, React, MariaDB, MongoDB, AWS IoT, Back-end, 백엔드개발자, 풀스택개발, full-stack development, Full-stack Engineer, backend developer, "
자동차튜닝 3D 가상체험 및 시공사 매칭 서비스 어플 개발자 모십니다.,Security,"Android, C#, iOS, "
Backend/Server Engineer,MySQL,"MySQL, Node.js, Amazon AWS, MariaDB, 서버관리, GitHub, React.js, JavaScript, "
핀테크 앱 개발자,AI,"Java, JavaScript, Ajax, JSON, restful, HTML5, CSS3, "
IOS 앱 개발자 모집,AI,"Java, JavaScript, Ajax, JSON, restful, HTML5, CSS3, "
[PHP 개발자] 재택근무 주4일 바짝 일하실 분 (최애 덕질 회사_덕후 우대),AI,"디지털콘텐츠, "
[핀테크] 프론트엔드 개발자 (경력),AI,"zeplin, Jenkins, React, aws, TypeScript, JavaScript, "
"스타트업 투자 플랫폼 블록체인,인공지능,빅데이터 개발자 모집",AI,"blockchain, bigdata, ai, ml, "
스타트업 투자 플랫폼 개발팀 충원,스타트,"React, 풀스택개발, JavaScript, iOS/AOS, 웹 프론트엔드 개발(HTML5/CSS3/JavaScript/Vue.js), Back-end, Node.js, Front-end, "
[스프트] 웹/앱 플랫폼 개발자를 찾습니다.,Android,"Android, iOS, React, MySQL, Node.js, Front-end, Back-end, jQuery, JavaScript, GitHub, "
웹 백-엔드 개발자를 찾습니다.,웹 백,"Android, iOS, React, MySQL, Node.js, Back-end, jQuery, GitHub, Java, "
[스탁키퍼] 프론트앤드 웹(Web) 개발자 모집,프론트앤,"Java, MySQL, Back-end, 풀스택개발, spring-framework, SpringBoot, rdbms, cache, Data structure, JavaScript, Git, GitHub, React, "
[스탁키퍼] 백엔드 서버 개발자 (Back-End Developer) 모집,개발자 (Back-En,"Java, MySQL, Back-end, 풀스택개발, spring-framework, SpringBoot, rdbms, cache, Data structure, JavaScript, Git, GitHub, React, Kotlin, React.js, Next.js, "
[스탁키퍼] 안드로이드 개발자 (Android Developer) 모집,안드로이드 개발자 (Androi,"Java, spring-framework, SpringBoot, rdbms, cache, Data structure, JavaScript, Git, GitHub, React, Android, Jenkins, Firebase, Kotlin, rx-java, "
[스탁키퍼] 풀스텍 개발자 (Full Stack Developer) 모집,개발자 (Full Stac,"Java, MySQL, Back-end, 풀스택개발, spring-framework, SpringBoot, rdbms, cache, Data structure, JavaScript, Git, GitHub, React, Redis, AWS Elastic Cache(Redis), JPA, gatsby, rxjs, Hibernate, Gradle, "
[스탁키퍼] IOS 개발자 (IOS Developer) 모집,IOS 개발자 (IO,"spring-framework, SpringBoot, rdbms, cache, Data structure, Git, GitHub, React, Swift, RxSwift, MVVM, autolayout, FlexLayout, snapkit, xctest, cocoapods, fastlane, QuickSight, Jenkins, nimble, "
백엔드 개발,AI,"Node.js, TypeScript, SQL, Database, Linux, Amazon AWS, "
Android 개발,AI,"Android, Kotlin, OpenSource, RxJava, jetpack, MVVM, "
블록체인 개발,AI,"Blockchain Developers, golang, Linux, Database, SQL, Docker, TypeScript, Java, Amazon AWS, "
프론트엔드 개발,AI,"React, CSS, HTML, angular, vue, webpack & babel, "
Data Analyst,Machine Learning,"Data Science, Big Data, data-visualization, Machine Learning, reporting-services, business-intelligence, data-analysis, NLP, "
Web Front-End Engineer,Web Front,"JavaScript, React, Front-end, Node.js, HTML5, CSS, ExpressJS, Styled-components, "
Back-End Engineer,Back-End,"Java, Back-end, MySQL, MongoDB, Amazon AWS, 서버관리, 빅데이터 분석/인프라/가시화, Hadoop, Apache Spark, Amazon Kinesis, Amazon EMR, Node.js, Python, PostgreSQL, Django, "
Big Data Engineer,"AWS, hadoop","Python, BigData Platform, NoSQL, weblog, Amazon AWS, hadoop-ecosystem, Datamining, datalake, data-visualization, Back-end, Django, "
한림대의료원 의료인공지능 연구원/개발자,"keras, Docker","Python, Java, Node.js, TensorFlow, PyTorch, keras, Docker, deep-learning, machine-learning, image-processing, 인공지능, object-detection, "
[Backend] 데이터 엔지니어/아키텍트로 성장하고 싶은 Python/Django 개발자,성장하고 싶은 Py,"Java, Python, machine-learning, Datamining, matrix-factorization, devops, data-structures, GitHub, agile, analytics, amazon-elb, Web Service, Django, Flask, Redis, recommendation, "
[Data Scientist] Personalization/Recommendation 핵심 연구개발,Scientist] Personalization/Recomme,"machine-learning, Datamining, matrix-factorization, data-structures, GitHub, analytics, recommendation, MySQL, MongoDB, deep-learning, NLP, Data Science, Machine Learning, Big Data, TensorFlow, 인공지능, artificial-intelligence, "
블록체인 벡엔드 개발자 (기술 리서치 포지션),,"Back-end, blockchain, "
[VueJs] [경력] 프론트엔드 개발자,,"Vue.js, HTML5, CSS3, jQuery, javascript, Git, Front-end, "
IoT 서버 개발자 채용 (경력),IoT,"Amazon AWS, JavaScript, REST, OAuth, mqtt, reactive-programming, mvp, Docker, 서버관리, Back-end, Node.js, Kubernetes, "
개발자 (인도네시아 자카르타에서 함께하실 개발자 필요합니다!!),AI,"Go, Flutter, Java, C, C++, C#, "
앱 프론트엔드 개발자 모집합니다 (React Native),프론트엔드 개발자 모집합니다,"Amazon EC2, JavaScript, Google Analytics, Slack, Amazon S3, Bootstrap, Node JS, MySQL, Python, jQuery, PHP, GitHub, "
백엔드 개발자 모집합니다,,"spring-boot, java framework, Spring, 백엔드 기술 Java, Spring, Node.js, MySQL, Node.js, "
[브랜디] 백엔드 개발자,"end, JavaScript","PHP, Python, MySQL, Amazon AWS, Back-end, JavaScript, Vue.js, Front-end, "
웹개발자 신입/경력채용(O2O),AI,"MySQL, Java, Python, Ajax, SQL, 웹프로그래머, "
[경력] 안드로이드 앱 개발 인재를 모십니다.,OpenGL ES,"Android, Java, C++, OpenGL ES, GLSL, computer-graphics, image-processing, "
[관심사 SNS 우트] Python-Django 3-5년차 경력 개발자 구인,,"Python, Django, Back-end, PostgreSQL, aws, "
[스타트업 태스크마켓] 앱(Front-end) 및 서버(Back-end) 개발자 채용,Amazon AWS,"Python, Back-end, Front-end, Amazon AWS, React, Django, GitHub, "
"서비스 개발자(Laravel, Python, React, AOS, iOS, QA) 직군 공개 채용 (경력, 인턴) - 렌톡/카로",서비스 개발자,"PHP, Python, MySQL, Back-end, React, Front-end, GitHub, Amazon AWS, Android, iOS, QA 테스터, "
국내 1위 글램의 '시니어 백엔드 개발자'를 모십니다!,AI,"PHP, Python, Java, Ruby, diango, Flask, Laravel, Spring, Rails, aws, GCP, Azure, Vue.js, "
국내 1위 글램의 '데이터 분석가'를 모십니다!,R,"데이터분석, 데이터사이언스, Python, R, 통계학, Machine Learning, Data Science, 머신러닝, "
국내 1위 글램의 'iOS Developer'를 모십니다!,,"iOS, Swift, ios-sdk, Objective-C, fastlane, "
국내 1위 글램의 '매치 백엔드 개발자'를 모십니다!,글램의 '매치 ,"PHP, Java, Android, Python, Ruby, Elasticsearch, Neo4j, ArangoDB, Amazon Neptune, message-queue, Django, Flask, Laravel, Spring, Rails, "
국내 1위 글램의 '백엔드 개발자'를 모십니다!,위 글램의 ',"Java, PHP, Python, Ruby, Django, Flask, Laravel, Spring, Rails, aws, GCP, Azure, message-queue, Kubernetes, docker-swarm, Neo4j, ArangoDB, Amazon Neptune, "
안드로이드 개발자님을 모십니다.,AI,"Android, Kotlin, iOS, Java, JSP, Swift, PHP, "
웹개발 / Java·JSP / 프론트 / 백엔드 정직원 채용(경력),AI,"PHP, jQuery, MySQL, AngularJS, Node.js, MongoDB, JSP, Amazon AWS, JavaScript, Java, "
CTO / 개발팀장,,"Python, MySQL, Back-end, Amazon AWS, 서버관리, Django, Git, Node.js, jQuery, JavaScript, React, "
경력_컴퓨터 비전 엔지니어(Computer Vision Engineer)채용,AI,"Java, C++, Python, "
경력_백엔드 개발자(Back-End Developer) 채용,경력_백엔드,"Java, C++, Python, Back-end, "
백엔드 프로그래머,,"Python, 백엔드, 백엔드개발자, Back-end, rdbms, PostgreSQL, MSA, soa, 오픈소스, 테스트자동화, 빌드자동화, 지속적통합, "
안드로이드 프로그래머,,"안드로이드, Android, android플랫폼, Kotlin, Java, RESTful-api, TypeScript, Python, Rust, C, Haskell, "
프론트엔드 프로그래머,,"Node.js, Front-end, React, JavaScript, 풀스택개발, "
iOS 프로그래머,iOS,"iOS, ios 앱개발, mvp, Swift, Swift 개발 경험자, RESTful-api, Kotlin, Python, TypeScript, Rust, Haskell, "
백앤드 개발자님(자바스크립트) 어디에 계신가요? 저희 정말 즐겁게 일하고 있습니다:).,Security,"Back-end, JavaScript, Node.js, Amazon AWS, Jenkins, Travis, Elasticsearch, Redux, TypeScript, ci, "
프론트앤드 개발자님(자바스크립트) 어디에 계신가요? 저희 정말 즐겁게 일하고 있습니다:).,Security,"JavaScript, React, react-native, HTML, saas, responsive-design, Java, Objective-C, Swift, Redux, Node.js, TypeScript, "
react/react native 프론트엔드 경력직 모집,"Git, react","JavaScript, React, Front-end, CSS, HTML5, Git, react-native, "
지도데이터 기술스타트업 측위연구원 (모바일개발자) 모집,AI,"Android, iOS, beacon, 2D/3D Image Processing, 모바일딥러닝, "
인공지능 지도데이터 기술스타트업 웹프론트 개발자 모집,AI,"HTML5, css/scss, Javascript(ES6), React.js, AngularJS, Vue.js, webgl, Open GL, "
인공지능 영상분석 스타트업 백엔드(java)개발 모집,,"Java, spring-framework, MSA, "
대기업계열 미디어렙 앱개발 모집,,"Android, ios 앱개발, Objective-C, Java, "
글로벌 웹툰플랫폼 ios 앱 개발자 모집,,"Swift, Objective-C, SVN, Git, "
인공지능 영상분석 스타트업 컴퓨터비전 및 AI 연구개발자 모집,AI,"C C++, Python, 영상처리 소프트웨어 알고리즘, DCNN, "
스타트업 커머셜 서비스 서버/프론트 개발자 모집,AI,"REST API, web/mobile application 개발, AWS EMR, spark, Big Data, Spring, angular 2, React, "
인공지능 영상분석 스타트업 AI 엔지니어 모집,AI,"C C++, Python, "
인공지능 지도데이터 기술스타트업 웹프론트 경력 모집,React,"JavaScript, HTML5, CSS3, React, Vue.js, AngularJS, webgl, Open GL, "
IT 스타트업 파이썬(python) 서버개발자 모집,AI,"Python, React, Go, aws, GCP, GitHub, REST API, "
핀테크(P2P) 스타트업 백엔드 개발자 모집,AI,"Android, Java, Kotlin, NoSQL, rdbms, JPA, hiberate, aws, "
지도데이터 스타트업 기술융합센터장 모집,"vision, image","딥러닝, 컴퓨터비전, 딥러닝이미지분석, object-detection, computer-vision, image-processing, 인공지능, Object Classification, 영상처리, "
애드테크 스타트업 디지털광고플랫폼 개발자 모집,AI,"DL/ML, API, Java, Node.js, Python, "
IT스타트업 웹 엔지니어 (경력 3년 이상),AI,"React, Redux, Node JS, MongoDB, MySQL, aws, "
대기업계열 미디어렙 웹개발 모집,AI,"PHP, MySQL, Apache, CodeIgniter, jQuery, JavaScript, Linux, "
"채용 플랫폼 리뉴얼 건 (Java, 풀스택) 계약직(재택 가능)",,"Java, spring-framework, graphql, Liquibase, Selenium, Amazon AWS, restful, es6, TypeScript, scss, npm, "
IT 스타트업 안드로이드(android)개발자 모집,AI,"Android, RxJava, MVVM, Slack, JIRA, Notion, GitHub, "
애드테크&커머스 스타트업 풀스텍 개발자 모집,AI,"REST, AWS EMR, spark, Spring, angular2, React, "
"일반멘토, 개발멘토",,"Python, C++, C#, Java, Back-end, "
벡엔드 개발자,AI,"Kotlin, Scala, Java, Spring Boot 2, "
[홈페이지지원]웹 백앤드 개발자 (경력),,"Back-end, "
[홈페이지지원]웹 프론트 개발자 (경력),홈페이지지원,"vue, JavaScript, Front-end, Back-end, Amazon AWS, 풀스택개발, React, 서버관리, 웹 프론트엔드 개발(HTML5/CSS3/JavaScript/Vue.js), 풀스택개발자, "
"인공지능(A.I.) 연구 개발자 채용 (인턴/신입/경력), 산업기능요원 포함",AI,"Python, "
"안드로이드 개발자 채용 (Android), 산업기능요원 포함",개발자 채용 (Andr,"Android, Java, Kotlin, 모바일앱, 모바일앱개발, 모바일서비스, native app 개발, 안드로이드 앱개발, 안드로이드개발, 안드로이드개발자, 안드로이드, 구글플레이, Android앱개발, 어플리케이션 개발, 안드로이드 개발, 코틀린, Java/Kotlin 혹은 Swift, Android Studio, Android Developers, google-play-store, "
"iOS 개발자 채용, 산업기능요원 포함",iOS 개발,"iOS, ios 앱개발, Swift, Swift 개발 경험자, Xcode, 모바일앱개발, 아이폰, Objective-C, iPhone, 아이폰개발자, 어플리케이션 개발, native app 개발, cocoapods, iOS Developer, mobile app developer, "
항공권 검색 엔진 개발자 채용 (경력직),,"Java, Sping framework, web, Back-end, API, MySQL, Node.js, jQuery, JavaScript, "
"웹 개발자, 백엔드 개발자",,"Java, MySQL, Back-end, "
백엔드 개발자를 찾습니다~!!!,,"Back-end, 백엔드개발자, 백엔드, 백엔드 개발, backend, backend developer, 웹백엔드, 백엔드 기술 Java, Spring, Node.js, MySQL, 서버개발자, "
안드로이드 앱 개발자(신입/경력)를 찾습니다~!!!,개발자(신,"Android, Android앱개발, 안드로이드 앱개발, 안드로이드개발자, 모바일앱개발, Kotlin, 안드로이드, 안드로이드 개발, 코틀린, 안드로이드개발, 어플리케이션 개발, native app 개발, "
개발팀 팀장,,"Python, Django, MySQL, Back-end, Amazon AWS, "
UI 마크업 개발자 (신입/경력),,"Front-end, JavaScript, CSS, HTML, "
백엔드 개발자 (Python/Django),,"Python, Django, MySQL, Back-end, "
"[서울시,경기도,충북, 공공배달앱 선정기업 ] Web & Android 개발자 & C++개발자",,"Android, Java, PHP, JavaScript, jQuery, MySQL, Amazon AWS, Back-end, Node.js, C, 아이폰개발자, "
[정규직] 웹 서버 개발 및 PDS 구축 업무 개발자 모집,Security,"Back-end, blockchain, "
블록체인 플랫폼 개발 / 분산 플랫폼 개발,AI,"Java, Node.js, 블록체인, blockchain, p2p, bitcoin, ethereum, 코인개발, 지갑 개발, dapp, tracker, SVN, torrent, Java/JSP, mockito, JUnit, hyperledger, 이더리움, Solidity, 암호화화폐, 비트코인, 가상화폐, 암호화폐, cryptocurrencyinsight, 알트코인, 자바스크립트, 자바개발자, Back-end, Amazon AWS, platform, Spring, spring-framework, spring-boot, SpringFramework, SpringBoot, Blockchain business, cryptography, blockchain community, "
[경력]DBA (Database Engineer),AI,"Kafka, Elasticsearch, KSQL, Stream, spark, hive, Storm, sqoop, HBase, Database, Kubernetes, "
Backend Developer / 백엔드 서버 개발자,Backend Develop,"Java, MySQL, DBMS(MS-SQL), Linux, UNIX, Node.js, Amazon AWS, Back-end, 풀스택개발, JavaScript, Kafka, GitHub, React, MongoDB, Git, "
개발팀 - 소프트웨어 엔지니어(전문연구요원 가능),HTML,"C, C++, packet-sniffers, HTML, JavaScript, Web Service, iOS/AOS, "
개발팀 - 모바일 개발자(전문연구요원 가능),개발팀 - 모바일,"Android, iOS, Swift, Kotlin, Objective-C, Java, 모바일앱개발, "
[AI 솔루션 기업] 머신 비전 R&D (팀원~리더급),머신 ,"AI(인공지능), 인공지능, 머신비전, 머신비전 개발, Deep Learning (딥러닝), 데이터 분석 / 딥러닝 모델 개발, deep-learning, TensorFlow, PyTorch, CUDA, Python, C, 씨피피, "
풀스텍 개발자 - 창업멤버 개발 총괄,풀스텍 개,"PHP, Java, JavaScript, jQuery, MySQL, Node.js, Amazon AWS, HTML5, Android, iOS, CSS3, React, Front-end, Back-end, 풀스택개발, CSS, Bootstrap, Vue.js, nuxt.js, Django, "
PHP 개발자 모십니다.,AI,"PHP, MySQL, JavaScript, HTML5, CSS3, jQuery, Amazon AWS, "
비전 검사장비 설계팀장(Solidworks사용),AI,"기구설계, solidworks, "
"광학 머신비전 장비 인공지능(AI), 딥러닝 담당자 모집","PyTorch, deep","ai, 인공지능, TensorFlow, 머신러닝, machine-learning, PyTorch, deep-learning, "
연구 개발,AI,"Android, C++, Python, Flutter & Dart, C, "
웹 프론트엔드(Front-End) 개발자를 찾습니다!,프론트엔드(Front-,"jQuery, JavaScript, HTML5, CSS3, Ajax, React, Front-end, Git, 웹서비스, Web Front-end, Vue.js, 웹 프론트엔드 개발(HTML5/CSS3/JavaScript/Vue.js), "
"Java, Spring 백엔드(Back-End) 개발자 채용",백엔드(B,"Java, MySQL, Amazon AWS, Back-end, ORM, JPA, SpringBoot, Git, Database, 서버관리, JPA:hibernate, Hibernate, backend developer, Docker, Jenkins, 백엔드 개발, 백엔드개발자, 백엔드, "
iOS 개발자 정규직 채용,Swift,"Swift, iOS, iPhone, ios 앱개발, RxSwift, 모바일앱개발, 아이폰, 아이폰개발자, Swift3.0, Swift 개발 경험자, "
Full Stack Developer Position,AI,"풀스택개발, Service Platform Software Architecture, "
[경력] ?깃플과 함께 성장할 프론트엔드 개발자를 찾고있습니다,,"JavaScript, AngularJS, Front-end, HTML5, CSS, HTML, TypeScript, "
프론트엔드 개발자(신입~3년),,"Front-end, JavaScript, CSS, HTML, Node.js, AngularJS, "
백엔드 개발자(2년 이상),,"Python, MySQL, Django, Node.js, Back-end, AngularJS, Google Cloud Platform (GCP), "
(주)테라젠바이오 프론트엔드 웹개발 신입/경력 정규직 채용,,"JavaScript, Front-end, React, Django, REST API, 웹 프론트엔드 개발(HTML5/CSS3/JavaScript/Vue.js), "
웹 시스템/플랫폼 개발자 (계약직),Back-end,"Front-end, Javascript(ES6+), Java, PHP, Back-end, Django, Spring, RESTful-api, Git, "
Django 풀스택 개발자,AI,"JavaScript, CSS3, Bootstrap, jQuery, HTML5, Django, aws, Python, PostgreSQL, Bitbucket, circle, "
커머스 기반 플랫폼 운영 및 고도화 담당자 모집,AI,"MySQL, SPA(vue), API, RDBMS MySQL, "
풀스택 플랫폼 개발팀장(경력 6년 이상) + 마이데이터 사업 운용가능자,년 이상) +,"React, JavaScript, CSS, HTML, HTML5, CSS3, GitHub, 풀스택개발, Node.js, jQuery, Amazon AWS, Front-end, Back-end, Vue.js, "
프론트엔드(1년 이상) 개발자 모집,AI,"웹 프론트엔드 개발(HTML5/CSS3/JavaScript/Vue.js), "
"Frontend Engineer 채용 (React or Vue or Angular, Front)",or Vue or ,"JavaScript, TypeScript, restful, React, 웹 프론트엔드 개발(HTML5/CSS3/JavaScript/Vue.js), AngularJS, UI/UX, rxjs, Front-end, HTML5, CSS, Vue.js, CSS3, jQuery, "
Backend Engineer 채용 (Java / Spring),Backend Engineer 채용 ,"Java, Spring, PostgreSQL, MySQL, Back-end, NoSQL, 백엔드 개발, Linux, Docker, Kubernetes, Kafka, RabbitMQ, Cassandra, Elasticsearch, Amazon AWS, Kotlin, Redis, SpringBoot, nginx, MessageQueues, "
Mobile Engineer (Android / iOS / Flutter) 채용,Swift,"Android, Java, iOS, Swift, Kotlin, React, Flutter, Objective-C, Flux, "
육아하는 아빠들을 위한 'TIME CURATION 캘린더' 울프플래닛을 함께 키워 나갈 열정적인 개발자를 찾습니다!,,"Back-end, JavaScript, CSS, React, HTML, 풀스택개발, 서버관리, Git, "
React Native & Firebase 개발자 채용,native 앱,"iOS, Android, react-native, ReactNative, react-native 앱 개발, React/React Native, Firebase, Firestore, "
